{
  "KO6_polarization": {
    "KO_chirality_used_as_statistics": false,
    "dimensions": {
      "minus": 48,
      "plus": 48
    },
    "grading": "Gamma96",
    "oddness": "Gamma96 D_phys(t) Gamma96=-D_phys(t)",
    "projectors": {
      "minus": "(I96-Gamma96)/2",
      "plus": "(I96+Gamma96)/2"
    },
    "role": "physical chiral restriction of the finite factor",
    "statistics_source": "Grassmann fermion fields in CBF.T25"
  },
  "authority_reconciliation": {
    "A56": "KO chirality is not used as statistics grading",
    "A73": "determinant response identity is instantiated only on the finite chiral block",
    "A84_A85": "complete upper action and finite matching are not promoted",
    "B_ACTION_01": "advanced but open at external measure, renormalized action and continuum transfer",
    "CBF_T27": "profile no-go remains for D and trace alone; selected fermion statistics, chiral block and chamber are added",
    "CBF_T29": "odd scalar trace still cancels; determinant uses the even B^*B block after Grassmann integration"
  },
  "check_summary": {
    "failed": [],
    "passed": 107,
    "total": 107
  },
  "checks": {
    "B_ACTION_01_remains_open": true,
    "B_SM_02_remains_open": true,
    "D0_is_self_adjoint": true,
    "D0_square_is_identity": true,
    "D1_is_self_adjoint": true,
    "Delta_star_is_exact": true,
    "Delta_star_is_positive": true,
    "H_phys_matches_T23": true,
    "KO_chirality_is_not_used_as_statistics": true,
    "SM_mass_identification_remains_open": true,
    "T20_source_is_exact": true,
    "T23_KO6_source_is_exact": true,
    "T25_fermion_action_is_exact": true,
    "T27_spectrum_is_exact": true,
    "T29_signed_action_is_exact": true,
    "all_sigma_values_are_positive": true,
    "all_three_chiral_branch_ranks_are_16": true,
    "branch_-2_commutes_with_grading": true,
    "branch_-2_is_H_eigenspace": true,
    "branch_-2_positive_chiral_rank_is_16": true,
    "branch_-2_projector_has_rank_32": true,
    "branch_-2_projector_is_idempotent": true,
    "branch_-2_projector_is_self_adjoint": true,
    "branch_-4_commutes_with_grading": true,
    "branch_-4_is_H_eigenspace": true,
    "branch_-4_positive_chiral_rank_is_16": true,
    "branch_-4_projector_has_rank_32": true,
    "branch_-4_projector_is_idempotent": true,
    "branch_-4_projector_is_self_adjoint": true,
    "branch_2_commutes_with_grading": true,
    "branch_2_is_H_eigenspace": true,
    "branch_2_positive_chiral_rank_is_16": true,
    "branch_2_projector_has_rank_32": true,
    "branch_2_projector_is_idempotent": true,
    "branch_2_projector_is_self_adjoint": true,
    "branch_order_is_strict": true,
    "chiral_projectors_are_orthogonal": true,
    "chiral_projectors_resolve_identity": true,
    "contract_schema_is_exact": true,
    "curvature_identity_is_exact": true,
    "curvature_is_positive": true,
    "dimensionless_values_are_newly_closed": true,
    "external_measure_remains_open": true,
    "finite_Gaussian_profile_is_newly_closed": true,
    "finite_KO6_fermion_action_is_available": true,
    "finite_chiral_determinant_degree_is_96": true,
    "finite_coordinate_is_newly_closed": true,
    "full_four_dimensional_determinant_remains_open": true,
    "grading_anticommutes_with_D0": true,
    "grading_anticommutes_with_D1": true,
    "grading_is_self_adjoint": true,
    "grading_square_is_identity": true,
    "handoff_is_pinned": true,
    "held_out_observable_remains_open": true,
    "kernel_model_is_pinned": true,
    "large_external_mode_condition_selects_one_third": true,
    "large_over_middle_ratio_is_exact": true,
    "large_over_small_ratio_is_exact": true,
    "middle_over_small_ratio_is_exact": true,
    "negative_chiral_dimension_is_48": true,
    "neutral_chamber_contains_zero": true,
    "neutral_chamber_is_newly_closed": true,
    "no_fitted_coefficients_used": true,
    "no_observed_values_used": true,
    "one_third_fails_zero_mode_stationary_polynomial": true,
    "other_root_is_outside_neutral_chamber": true,
    "overall_scale_remains_open": true,
    "physical_packet_acceptance_unchanged": true,
    "physical_row_acceptance_unchanged": true,
    "positive_chiral_dimension_is_48": true,
    "renormalization_scheme_remains_open": true,
    "sample_0_BstarB_equals_chiral_Dsquare": true,
    "sample_0_determinant_identity": true,
    "sample_1_over_4_BstarB_equals_chiral_Dsquare": true,
    "sample_1_over_4_determinant_identity": true,
    "sample_3_over_4_BstarB_equals_chiral_Dsquare": true,
    "sample_3_over_4_determinant_identity": true,
    "sample_minus_1_over_2_BstarB_equals_chiral_Dsquare": true,
    "sample_minus_1_over_2_determinant_identity": true,
    "selected_root_has_tight_rational_isolation": true,
    "selected_root_is_in_neutral_chamber": true,
    "selected_root_is_nonzero": true,
    "sigma_minus2_is_exact": true,
    "sigma_minus2_square_is_exact": true,
    "sigma_minus4_is_exact": true,
    "sigma_minus4_square_is_exact": true,
    "sigma_plus2_is_exact": true,
    "sigma_plus2_square_is_exact": true,
    "source_01_hash_matches": true,
    "source_02_hash_matches": true,
    "source_03_hash_matches": true,
    "source_04_hash_matches": true,
    "source_05_hash_matches": true,
    "source_06_hash_matches": true,
    "source_07_hash_matches": true,
    "source_08_hash_matches": true,
    "source_09_hash_matches": true,
    "source_10_hash_matches": true,
    "source_11_hash_matches": true,
    "source_lock_schema_is_exact": true,
    "source_root_is_nonempty": true,
    "spectral_projectors_are_pairwise_orthogonal": true,
    "spectral_projectors_resolve_identity": true,
    "stationary_polynomial_vanishes_at_other_root": true,
    "stationary_polynomial_vanishes_at_selected_root": true,
    "strict_top_level_contract": true,
    "zero_mode_stationarity_differs_from_large_external_mode": true
  },
  "chiral_finite_operator": {
    "Delta": "(1-2t)(1-t)(1+t)",
    "definition": "B(t)=P_chi^- D_phys(t) P_chi^+",
    "determinant_identity": "det(B^*B)=Delta(t)^32",
    "exact_rational_samples": [
      {
        "Delta": "3/2",
        "det_BstarB": "1853020188851841/4294967296",
        "t": "-1/2"
      },
      {
        "Delta": "1",
        "det_BstarB": "1",
        "t": "0"
      },
      {
        "Delta": "15/32",
        "det_BstarB": "43143988327398919500410556793212890625/1461501637330902918203684832716283019655932542976",
        "t": "1/4"
      },
      {
        "Delta": "-7/32",
        "det_BstarB": "1104427674243920646305299201/1461501637330902918203684832716283019655932542976",
        "t": "3/4"
      }
    ],
    "positive_block": "B(t)^*B(t)=P_chi^+D_phys(t)^2P_chi^+",
    "positive_block_spectrum": {
      "(1+t)^2": 16,
      "(1-2t)^2": 16,
      "(1-t)^2": 16
    },
    "response_branch_multiplicities": {
      "-2": 16,
      "-4": 16,
      "2": 16
    }
  },
  "claim_id": "CBF.T30",
  "conditional_one_scale_values": {
    "SM_mass_claimed": false,
    "common_scale_h_selected_numerically": false,
    "formula": "m_lambda=h sigma_lambda",
    "inherited_common_scale_count": 1,
    "new_dimensionless_shape_parameters": 0,
    "sector_assignment_selected": false
  },
  "date": "2026-08-30",
  "dimensionless_branch_values": {
    "fitted_coefficients_used": false,
    "identified_with_measured_generations": false,
    "observed_values_used": false,
    "ordered_by_response_eigenvalue": {
      "-2": {
        "decimal": "1.434258545910664882",
        "exact_coefficients": {
          "rational": "5/6",
          "sqrt13": "1/6"
        },
        "expression": "(5+sqrt(13))/6",
        "square_exact_coefficients": {
          "rational": "19/18",
          "sqrt13": "5/18"
        }
      },
      "-4": {
        "decimal": "1.868517091821329764",
        "exact_coefficients": {
          "rational": "2/3",
          "sqrt13": "1/3"
        },
        "expression": "(2+sqrt(13))/3",
        "square_exact_coefficients": {
          "rational": "17/9",
          "sqrt13": "4/9"
        }
      },
      "2": {
        "decimal": "0.565741454089335118",
        "exact_coefficients": {
          "rational": "7/6",
          "sqrt13": "-1/6"
        },
        "expression": "(7-sqrt(13))/6",
        "square_exact_coefficients": {
          "rational": "31/18",
          "sqrt13": "-7/18"
        }
      }
    },
    "ratios": {
      "sigma_-2_over_sigma_+2": {
        "decimal": "2.535183758487996431",
        "exact_coefficients": {
          "rational": "4/3",
          "sqrt13": "1/3"
        },
        "expression": "(4+sqrt(13))/3"
      },
      "sigma_-4_over_sigma_+2": {
        "decimal": "3.302775637731994647",
        "exact_coefficients": {
          "rational": "3/2",
          "sqrt13": "1/2"
        },
        "expression": "(3+sqrt(13))/2"
      },
      "sigma_-4_over_sigma_-2": {
        "decimal": "1.302775637731994647",
        "exact_coefficients": {
          "rational": "-1/2",
          "sqrt13": "1/2"
        },
        "expression": "(sqrt(13)-1)/2"
      }
    },
    "strict_order": "sigma_-4>sigma_-2>sigma_+2>0"
  },
  "external_mode_obstruction": {
    "common_stationary_coordinate_for_all_external_modes": false,
    "finite_selected_coordinate_is_final_4D_vacuum": false,
    "full_spacetime_spectral_measure_required": true,
    "large_external_mode_leading_stationarity": "-2+6t=0, hence t=1/3",
    "renormalization_and_counterterms_required": true,
    "single_mode_profile": "Wx(t)=-(1/3)sum_lambda log(x+r_lambda(t)^2)",
    "x_definition": "x=p^2/h^2",
    "zero_external_mode_stationarity": "3t^2-t-1=0"
  },
  "finite_Grassmann_Gaussian": {
    "Pfaffian_convention_effect": "positive overall multiplier only within a fixed oriented chamber",
    "complex_Gaussian_modulus": "|det B(t)|^2=det(B(t)^*B(t))",
    "fermionic_sign_source": "Grassmann integration",
    "full_4D_determinant_claimed": false,
    "normalized_effective_profile": "W0(t)=-(1/48)log det(B^*B)=-(2/3)log|Delta(t)|",